{
  "cadgf_version": "1.0.0",
  "schema_version": 1,
  "feature_flags": {
    "earcut": true,
    "clipper2": true
  },
  "metadata": {
    "label": "cadgf_smoke_fixture",
    "author": "cadgamefusion",
    "company": "",
    "comment": "Synthetic fixture for editor_roundtrip_smoke (non-proprietary).",
    "created_at": "2026-02-12T00:00:00Z",
    "modified_at": "2026-02-12T00:00:00Z",
    "unit_name": "mm",
    "meta": {}
  },
  "settings": {
    "unit_scale": 1.0
  },
  "layers": [
    {
      "id": 0,
      "name": "0",
      "color": 0,
      "visible": 1,
      "locked": 0,
      "printable": 1,
      "frozen": 0,
      "construction": 0
    },
    {
      "id": 1,
      "name": "LOCKED",
      "color": 16711680,
      "visible": 1,
      "locked": 1,
      "printable": 1,
      "frozen": 0,
      "construction": 0
    }
  ],
  "entities": [
    {
      "id": 1,
      "type": 2,
      "layer_id": 0,
      "name": "LINE_1",
      "line": [[0, 0], [10, 0]],
      "space": "model"
    },
    {
      "id": 2,
      "type": 0,
      "layer_id": 0,
      "name": "PLINE_1",
      "polyline": [[0, 0], [0, 10], [10, 10]],
      "space": "model"
    },
    {
      "id": 3,
      "type": 4,
      "layer_id": 0,
      "name": "CIRCLE_1",
      "circle": { "c": [5, 5], "r": 3 },
      "space": "model"
    },
    {
      "id": 4,
      "type": 3,
      "layer_id": 0,
      "name": "ARC_1",
      "arc": { "c": [5, 5], "r": 3, "a0": 0, "a1": 1.5707963267948966, "cw": 1 },
      "space": "model"
    },
    {
      "id": 5,
      "type": 7,
      "layer_id": 0,
      "name": "TEXT_1",
      "text": { "pos": [1, 1], "h": 2.5, "rot": 0, "value": "HELLO" },
      "space": "model"
    },
    {
      "id": 6,
      "type": 5,
      "layer_id": 1,
      "name": "ELLIPSE_UNSUPPORTED",
      "ellipse": { "c": [8, 8], "rx": 2.0, "ry": 1.0, "rot": 0.1, "a0": 0.0, "a1": 6.283185307179586 },
      "space": "model",
      "note": "unsupported entity type for web editor; must survive round-trip"
    },
    {
      "id": 7,
      "type": 6,
      "layer_id": 1,
      "name": "SPLINE_UNSUPPORTED",
      "spline": { "degree": 3, "control": [[0, 0], [2, 4], [6, 4], [8, 0]], "knots": [0, 0, 0, 0, 1, 1, 1, 1] },
      "space": "model",
      "note": "unsupported entity type for web editor; must survive round-trip"
    }
  ]
}

