{
  "cadgf_version": "1.0.0",
  "schema_version": 1,
  "feature_flags": {
    "earcut": true,
    "clipper2": true
  },
  "metadata": {
    "label": "editor_insert_group_fixture",
    "author": "cadgamefusion",
    "company": "",
    "comment": "Synthetic fixture for INSERT fragment group workflow smoke.",
    "created_at": "2026-03-23T00:00:00Z",
    "modified_at": "2026-03-23T00:00:00Z",
    "unit_name": "mm",
    "meta": {}
  },
  "settings": {
    "unit_scale": 1.0
  },
  "layers": [
    {
      "id": 1,
      "name": "PLOT",
      "color": 8421504,
      "visible": 1,
      "locked": 0,
      "printable": 1,
      "frozen": 0,
      "construction": 0
    }
  ],
  "entities": [
    {
      "id": 7,
      "type": 2,
      "layer_id": 1,
      "name": "insert-group-line-a",
      "color": 8421504,
      "color_source": "BYLAYER",
      "source_type": "INSERT",
      "edit_mode": "fragment",
      "group_id": 500,
      "block_name": "DoorTag",
      "space": 1,
      "layout": "Layout-A",
      "line": [[-18, 0], [18, 0]]
    },
    {
      "id": 8,
      "type": 4,
      "layer_id": 1,
      "name": "insert-group-circle-a",
      "color": 8421504,
      "color_source": "BYLAYER",
      "source_type": "INSERT",
      "edit_mode": "fragment",
      "group_id": 500,
      "block_name": "DoorTag",
      "space": 1,
      "layout": "Layout-A",
      "circle": {
        "c": [0, 10],
        "r": 4
      }
    },
    {
      "id": 9,
      "type": 7,
      "layer_id": 1,
      "name": "insert-group-text-a",
      "color": 8421504,
      "color_source": "BYLAYER",
      "source_type": "INSERT",
      "edit_mode": "proxy",
      "proxy_kind": "text",
      "group_id": 500,
      "block_name": "DoorTag",
      "space": 1,
      "layout": "Layout-A",
      "text": {
        "pos": [12, 11],
        "h": 2.5,
        "rot": 0,
        "value": "TAG-A"
      }
    },
    {
      "id": 10,
      "type": 2,
      "layer_id": 1,
      "name": "insert-group-line-b",
      "color": 8421504,
      "color_source": "BYLAYER",
      "source_type": "INSERT",
      "edit_mode": "fragment",
      "group_id": 500,
      "block_name": "DoorTag",
      "space": 1,
      "layout": "Layout-B",
      "line": [[-16, -12], [16, -12]]
    },
    {
      "id": 12,
      "type": 2,
      "layer_id": 1,
      "name": "insert-group-line-c",
      "color": 8421504,
      "color_source": "BYLAYER",
      "source_type": "INSERT",
      "edit_mode": "fragment",
      "group_id": 500,
      "block_name": "DoorTag",
      "space": 1,
      "layout": "Layout-C",
      "line": [[-14, 20], [14, 20]]
    },
    {
      "id": 13,
      "type": 4,
      "layer_id": 1,
      "name": "insert-group-circle-c",
      "color": 8421504,
      "color_source": "BYLAYER",
      "source_type": "INSERT",
      "edit_mode": "fragment",
      "group_id": 500,
      "block_name": "DoorTag",
      "space": 1,
      "layout": "Layout-C",
      "circle": {
        "c": [0, 28],
        "r": 3
      }
    },
    {
      "id": 14,
      "type": 7,
      "layer_id": 1,
      "name": "insert-group-text-c",
      "color": 8421504,
      "color_source": "BYLAYER",
      "source_type": "INSERT",
      "edit_mode": "proxy",
      "proxy_kind": "text",
      "group_id": 500,
      "block_name": "DoorTag",
      "space": 1,
      "layout": "Layout-C",
      "text": {
        "pos": [10, 29],
        "h": 2.5,
        "rot": 0,
        "value": "TAG-C"
      }
    },
    {
      "id": 11,
      "type": 2,
      "layer_id": 1,
      "name": "insert-group-line-other",
      "color": 8421504,
      "color_source": "BYLAYER",
      "source_type": "INSERT",
      "edit_mode": "fragment",
      "group_id": 501,
      "block_name": "WindowTag",
      "space": 1,
      "layout": "Layout-A",
      "line": [[-16, 18], [16, 18]]
    },
    {
      "id": 20,
      "type": 2,
      "layer_id": 1,
      "name": "insert-notes-line-a",
      "color": 8421504,
      "color_source": "BYLAYER",
      "source_type": "INSERT",
      "edit_mode": "fragment",
      "group_id": 700,
      "block_name": "DoorNotes",
      "space": 1,
      "layout": "Layout-A",
      "line": [[40, 0], [64, 0]]
    },
    {
      "id": 21,
      "type": 7,
      "layer_id": 1,
      "name": "tag-main",
      "color": 8421504,
      "color_source": "BYLAYER",
      "source_type": "INSERT",
      "edit_mode": "proxy",
      "proxy_kind": "text",
      "group_id": 700,
      "block_name": "DoorNotes",
      "space": 1,
      "layout": "Layout-A",
      "text": {
        "pos": [44, 3],
        "h": 2.5,
        "rot": 0,
        "value": "MAIN-A"
      }
    },
    {
      "id": 22,
      "type": 7,
      "layer_id": 1,
      "name": "tag-sub",
      "color": 8421504,
      "color_source": "BYLAYER",
      "source_type": "INSERT",
      "edit_mode": "proxy",
      "proxy_kind": "text",
      "group_id": 700,
      "block_name": "DoorNotes",
      "space": 1,
      "layout": "Layout-A",
      "text": {
        "pos": [58, 3],
        "h": 2.5,
        "rot": 0,
        "value": "SUB-A"
      }
    },
    {
      "id": 23,
      "type": 2,
      "layer_id": 1,
      "name": "insert-notes-line-b",
      "color": 8421504,
      "color_source": "BYLAYER",
      "source_type": "INSERT",
      "edit_mode": "fragment",
      "group_id": 700,
      "block_name": "DoorNotes",
      "space": 1,
      "layout": "Layout-B",
      "line": [[42, -18], [66, -18]]
    },
    {
      "id": 24,
      "type": 7,
      "layer_id": 1,
      "name": "tag-main",
      "color": 8421504,
      "color_source": "BYLAYER",
      "source_type": "INSERT",
      "edit_mode": "proxy",
      "proxy_kind": "text",
      "group_id": 700,
      "block_name": "DoorNotes",
      "space": 1,
      "layout": "Layout-B",
      "text": {
        "pos": [46, -15],
        "h": 2.5,
        "rot": 0,
        "value": "MAIN-B"
      }
    },
    {
      "id": 25,
      "type": 7,
      "layer_id": 1,
      "name": "tag-sub",
      "color": 8421504,
      "color_source": "BYLAYER",
      "source_type": "INSERT",
      "edit_mode": "proxy",
      "proxy_kind": "text",
      "group_id": 700,
      "block_name": "DoorNotes",
      "space": 1,
      "layout": "Layout-B",
      "text": {
        "pos": [60, -15],
        "h": 2.5,
        "rot": 0,
        "value": "SUB-B"
      }
    },
    {
      "id": 26,
      "type": 2,
      "layer_id": 1,
      "name": "insert-notes-line-c",
      "color": 8421504,
      "color_source": "BYLAYER",
      "source_type": "INSERT",
      "edit_mode": "fragment",
      "group_id": 700,
      "block_name": "DoorNotes",
      "space": 1,
      "layout": "Layout-C",
      "line": [[44, 22], [68, 22]]
    },
    {
      "id": 27,
      "type": 7,
      "layer_id": 1,
      "name": "tag-main",
      "color": 8421504,
      "color_source": "BYLAYER",
      "source_type": "INSERT",
      "edit_mode": "proxy",
      "proxy_kind": "text",
      "group_id": 700,
      "block_name": "DoorNotes",
      "space": 1,
      "layout": "Layout-C",
      "text": {
        "pos": [48, 25],
        "h": 2.5,
        "rot": 0,
        "value": "MAIN-C"
      }
    },
    {
      "id": 28,
      "type": 7,
      "layer_id": 1,
      "name": "tag-sub",
      "color": 8421504,
      "color_source": "BYLAYER",
      "source_type": "INSERT",
      "edit_mode": "proxy",
      "proxy_kind": "text",
      "group_id": 700,
      "block_name": "DoorNotes",
      "space": 1,
      "layout": "Layout-C",
      "text": {
        "pos": [62, 25],
        "h": 2.5,
        "rot": 0,
        "value": "SUB-C"
      }
    }
  ]
}
