{
  "cadgf_version": "1.0.0",
  "schema_version": 1,
  "feature_flags": {"earcut": false, "clipper2": false},
  "metadata": {
    "label": "",
    "author": "",
    "company": "",
    "comment": "",
    "created_at": "",
    "modified_at": "",
    "unit_name": "",
    "meta": {"dxf.default_space": "0", "dxf.default_text_height": "2.500000", "dxf.entity.1.attribute_constant": "0", "dxf.entity.1.attribute_flags": "16", "dxf.entity.1.attribute_invisible": "0", "dxf.entity.1.attribute_lock_position": "1", "dxf.entity.1.attribute_preset": "0", "dxf.entity.1.attribute_tag": "ATTRIB_TAG", "dxf.entity.1.attribute_verify": "0", "dxf.entity.1.block_name": "AttribBlock", "dxf.entity.1.color_source": "BYLAYER", "dxf.entity.1.edit_mode": "exploded", "dxf.entity.1.proxy_kind": "insert", "dxf.entity.1.source_type": "INSERT", "dxf.entity.1.space": "0", "dxf.entity.1.text_kind": "attrib", "dxf.entity.2.block_name": "AttdefBlock", "dxf.entity.2.color_source": "BYLAYER", "dxf.entity.2.edit_mode": "exploded", "dxf.entity.2.proxy_kind": "insert", "dxf.entity.2.source_type": "INSERT", "dxf.entity.2.space": "0", "dxf.entity.3.attribute_constant": "0", "dxf.entity.3.attribute_default": "ATTDEF_INSERT_DEFAULT", "dxf.entity.3.attribute_flags": "12", "dxf.entity.3.attribute_invisible": "0", "dxf.entity.3.attribute_lock_position": "0", "dxf.entity.3.attribute_preset": "1", "dxf.entity.3.attribute_prompt": "ATTDEF_PROMPT", "dxf.entity.3.attribute_tag": "ATTDEF_TAG", "dxf.entity.3.attribute_verify": "1", "dxf.entity.3.block_name": "AttdefBlock", "dxf.entity.3.color_source": "BYLAYER", "dxf.entity.3.edit_mode": "exploded", "dxf.entity.3.proxy_kind": "insert", "dxf.entity.3.source_type": "INSERT", "dxf.entity.3.space": "0", "dxf.entity.3.text_kind": "attdef", "dxf.entity.4.block_name": "AttribBlock", "dxf.entity.4.color_source": "BYLAYER", "dxf.entity.4.edit_mode": "exploded", "dxf.entity.4.proxy_kind": "insert", "dxf.entity.4.source_type": "INSERT", "dxf.entity.4.space": "0", "dxf.entity.5.attribute_constant": "1", "dxf.entity.5.attribute_default": "HIDDEN_CONST_DEFAULT", "dxf.entity.5.attribute_flags": "3", "dxf.entity.5.attribute_invisible": "1", "dxf.entity.5.attribute_lock_position": "0", "dxf.entity.5.attribute_preset": "0", "dxf.entity.5.attribute_prompt": "HIDDEN_CONST_PROMPT", "dxf.entity.5.attribute_tag": "HIDDEN_CONST_TAG", "dxf.entity.5.attribute_verify": "0", "dxf.entity.5.block_name": "HiddenConstBlock", "dxf.entity.5.color_source": "BYLAYER", "dxf.entity.5.edit_mode": "exploded", "dxf.entity.5.proxy_kind": "insert", "dxf.entity.5.source_type": "INSERT", "dxf.entity.5.space": "0", "dxf.entity.5.text_kind": "attdef", "dxf.entity.6.block_name": "HiddenConstBlock", "dxf.entity.6.color_source": "BYLAYER", "dxf.entity.6.edit_mode": "exploded", "dxf.entity.6.proxy_kind": "insert", "dxf.entity.6.source_type": "INSERT", "dxf.entity.6.space": "0", "dxf.hatch_pattern_boundary_points_clamped_hatches": "0", "dxf.hatch_pattern_boundary_points_limit": "20000", "dxf.hatch_pattern_boundary_points_max": "0", "dxf.hatch_pattern_clamped": "0", "dxf.hatch_pattern_clamped_hatches": "0", "dxf.hatch_pattern_edge_budget_exhausted_hatches": "0", "dxf.hatch_pattern_edge_checks": "0", "dxf.hatch_pattern_edge_checks_limit_per_doc": "40000000", "dxf.hatch_pattern_edge_checks_limit_per_hatch": "10000000", "dxf.hatch_pattern_emitted_lines": "0", "dxf.hatch_pattern_ksteps_limit": "5000", "dxf.hatch_pattern_stride_max": "1", "dxf.text.align_complete": "0", "dxf.text.align_partial": "0", "dxf.text.align_partial_x_only": "0", "dxf.text.align_partial_y_only": "0", "dxf.text.align_policy": "strict", "dxf.text.align_used": "0", "dxf.text.entities_emitted": "3", "dxf.text.entities_seen": "3", "dxf.text.nonfinite_values": "0", "dxf.text.skipped_missing_xy": "0"}
  },
  "settings": {"unit_scale": 1.000000},
  "layers": [
    {"id": 0, "name": "0", "color": 16777215, "visible": 1, "locked": 0, "printable": 1, "frozen": 0, "construction": 0}
  ],
  "entities": [
    {"id": 1, "type": 7, "layer_id": 0, "name": "", "line_type_scale": 1.000000, "group_id": 1, "color_source": "BYLAYER", "space": 0, "source_type": "INSERT", "edit_mode": "exploded", "proxy_kind": "insert", "block_name": "AttribBlock", "text": {"pos": [67.000000, 12.000000], "h": 2.500000, "rot": 0.000000, "value": "ATTRIB_INSERT_OVERRIDE"}, "text_kind": "attrib", "attribute_tag": "ATTRIB_TAG", "attribute_flags": 16, "attribute_invisible": false, "attribute_constant": false, "attribute_verify": false, "attribute_preset": false, "attribute_lock_position": true},
    {"id": 2, "type": 2, "layer_id": 0, "name": "", "line_type_scale": 1.000000, "group_id": 2, "color_source": "BYLAYER", "space": 0, "source_type": "INSERT", "edit_mode": "exploded", "proxy_kind": "insert", "block_name": "AttdefBlock", "line": [[20.000000, 10.000000], [32.000000, 10.000000]]},
    {"id": 3, "type": 7, "layer_id": 0, "name": "", "line_type_scale": 1.000000, "group_id": 2, "color_source": "BYLAYER", "space": 0, "source_type": "INSERT", "edit_mode": "exploded", "proxy_kind": "insert", "block_name": "AttdefBlock", "text": {"pos": [26.000000, 12.000000], "h": 2.500000, "rot": 0.000000, "value": "ATTDEF_INSERT_DEFAULT"}, "text_kind": "attdef", "attribute_tag": "ATTDEF_TAG", "attribute_default": "ATTDEF_INSERT_DEFAULT", "attribute_prompt": "ATTDEF_PROMPT", "attribute_flags": 12, "attribute_invisible": false, "attribute_constant": false, "attribute_verify": true, "attribute_preset": true, "attribute_lock_position": false},
    {"id": 4, "type": 2, "layer_id": 0, "name": "", "line_type_scale": 1.000000, "group_id": 1, "color_source": "BYLAYER", "space": 0, "source_type": "INSERT", "edit_mode": "exploded", "proxy_kind": "insert", "block_name": "AttribBlock", "line": [[60.000000, 10.000000], [74.000000, 10.000000]]},
    {"id": 5, "type": 7, "layer_id": 0, "name": "", "line_type_scale": 1.000000, "group_id": 3, "color_source": "BYLAYER", "space": 0, "source_type": "INSERT", "edit_mode": "exploded", "proxy_kind": "insert", "block_name": "HiddenConstBlock", "text": {"pos": [106.000000, 22.000000], "h": 2.500000, "rot": 0.000000, "value": "HIDDEN_CONST_DEFAULT"}, "text_kind": "attdef", "attribute_tag": "HIDDEN_CONST_TAG", "attribute_default": "HIDDEN_CONST_DEFAULT", "attribute_prompt": "HIDDEN_CONST_PROMPT", "attribute_flags": 3, "attribute_invisible": true, "attribute_constant": true, "attribute_verify": false, "attribute_preset": false, "attribute_lock_position": false},
    {"id": 6, "type": 2, "layer_id": 0, "name": "", "line_type_scale": 1.000000, "group_id": 3, "color_source": "BYLAYER", "space": 0, "source_type": "INSERT", "edit_mode": "exploded", "proxy_kind": "insert", "block_name": "HiddenConstBlock", "line": [[96.000000, 18.000000], [116.000000, 18.000000]]}
  ]
}
