{
  "cadgf_version": "1.0.0",
  "schema_version": 1,
  "feature_flags": {
    "earcut": true,
    "clipper2": true
  },
  "metadata": {
    "label": "cadgf_smoke_derived_proxy_fixture",
    "author": "cadgamefusion",
    "company": "",
    "comment": "Synthetic fixture covering derived proxy metadata/read-only semantics.",
    "created_at": "2026-03-07T00:00:00Z",
    "modified_at": "2026-03-07T00:00:00Z",
    "unit_name": "mm",
    "meta": {}
  },
  "settings": {
    "unit_scale": 1.0
  },
  "layers": [
    {
      "id": 0,
      "name": "0",
      "color": 0,
      "visible": 1,
      "locked": 0,
      "printable": 1,
      "frozen": 0,
      "construction": 0
    }
  ],
  "entities": [
    {
      "id": 1,
      "type": 2,
      "layer_id": 0,
      "name": "INSERT_LINE_PROXY",
      "line": [[0, 0], [12, 0]],
      "space": "model",
      "source_type": "INSERT",
      "edit_mode": "exploded",
      "proxy_kind": "insert",
      "block_name": "TITLE"
    },
    {
      "id": 2,
      "type": 7,
      "layer_id": 0,
      "name": "DIMENSION_TEXT_PROXY",
      "text": { "pos": [15, 2], "h": 2.5, "rot": 0, "value": "42" },
      "space": "model",
      "source_type": "DIMENSION",
      "edit_mode": "proxy",
      "proxy_kind": "dimension",
      "text_kind": "dimension",
      "dim_type": 0,
      "dim_style": "STANDARD",
      "dim_text_pos": [15, 2],
      "dim_text_rotation": 0
    },
    {
      "id": 3,
      "type": 0,
      "layer_id": 0,
      "name": "HATCH_BOUNDARY_PROXY",
      "polyline": [[20, 0], [26, 0], [26, 4], [20, 4], [20, 0]],
      "space": "model",
      "source_type": "HATCH",
      "edit_mode": "proxy",
      "proxy_kind": "hatch",
      "hatch_id": 17,
      "hatch_pattern": "ANSI31"
    }
  ]
}
