{
  "cadgf_version": "1.0.0",
  "schema_version": 1,
  "feature_flags": {
    "earcut": true,
    "clipper2": true
  },
  "metadata": {
    "label": "editor_source_group_fixture",
    "author": "cadgamefusion",
    "company": "",
    "comment": "Synthetic fixture for grouped DIMENSION/LEADER/HATCH proxy workflow smoke.",
    "created_at": "2026-03-23T00:00:00Z",
    "modified_at": "2026-03-23T00:00:00Z",
    "unit_name": "mm",
    "meta": {}
  },
  "settings": {
    "unit_scale": 1.0
  },
  "layers": [
    {
      "id": 1,
      "name": "ANNOTATION",
      "color": 8421504,
      "visible": 1,
      "locked": 0,
      "printable": 1,
      "frozen": 0,
      "construction": 0
    }
  ],
  "entities": [
    {
      "id": 21,
      "type": 2,
      "layer_id": 1,
      "name": "dim-line-main",
      "color": 8421504,
      "color_source": "BYLAYER",
      "source_type": "DIMENSION",
      "edit_mode": "proxy",
      "proxy_kind": "dimension",
      "group_id": 700,
      "dim_type": 0,
      "dim_style": "STANDARD",
      "space": 1,
      "layout": "Layout-A",
      "line": [[-20, 0], [20, 0]]
    },
    {
      "id": 22,
      "type": 2,
      "layer_id": 1,
      "name": "dim-ext-left",
      "color": 8421504,
      "color_source": "BYLAYER",
      "source_type": "DIMENSION",
      "edit_mode": "proxy",
      "proxy_kind": "dimension",
      "group_id": 700,
      "dim_type": 0,
      "dim_style": "STANDARD",
      "space": 1,
      "layout": "Layout-A",
      "line": [[-20, 0], [-20, 12]]
    },
    {
      "id": 23,
      "type": 2,
      "layer_id": 1,
      "name": "dim-ext-right",
      "color": 8421504,
      "color_source": "BYLAYER",
      "source_type": "DIMENSION",
      "edit_mode": "proxy",
      "proxy_kind": "dimension",
      "group_id": 700,
      "dim_type": 0,
      "dim_style": "STANDARD",
      "space": 1,
      "layout": "Layout-A",
      "line": [[20, 0], [20, 12]]
    },
    {
      "id": 24,
      "type": 7,
      "layer_id": 1,
      "name": "dim-text",
      "color": 8421504,
      "color_source": "BYLAYER",
      "source_type": "DIMENSION",
      "edit_mode": "proxy",
      "proxy_kind": "dimension",
      "group_id": 700,
      "dim_type": 0,
      "dim_style": "STANDARD",
      "dim_text_pos": [0, 14],
      "dim_text_rotation": 0,
      "space": 1,
      "layout": "Layout-A",
      "text": {
        "pos": [0, 14],
        "h": 2.5,
        "rot": 0,
        "value": "42"
      }
    },
    {
      "id": 25,
      "type": 2,
      "layer_id": 1,
      "name": "dim-line-layout-b",
      "color": 8421504,
      "color_source": "BYLAYER",
      "source_type": "DIMENSION",
      "edit_mode": "proxy",
      "proxy_kind": "dimension",
      "group_id": 700,
      "dim_type": 0,
      "dim_style": "STANDARD",
      "space": 1,
      "layout": "Layout-B",
      "line": [[-10, -4], [10, -4]]
    },
    {
      "id": 31,
      "type": 0,
      "layer_id": 1,
      "name": "hatch-boundary",
      "color": 8421504,
      "color_source": "BYLAYER",
      "source_type": "HATCH",
      "edit_mode": "proxy",
      "proxy_kind": "hatch",
      "group_id": 701,
      "hatch_id": 17,
      "hatch_pattern": "ANSI31",
      "space": 1,
      "layout": "Layout-A",
      "polyline": [[30, 0], [38, 0], [38, 6], [30, 6], [30, 0]]
    },
    {
      "id": 32,
      "type": 2,
      "layer_id": 1,
      "name": "hatch-stripe-a",
      "color": 8421504,
      "color_source": "BYLAYER",
      "source_type": "HATCH",
      "edit_mode": "proxy",
      "proxy_kind": "hatch",
      "group_id": 701,
      "hatch_id": 17,
      "hatch_pattern": "ANSI31",
      "space": 1,
      "layout": "Layout-A",
      "line": [[31, 1], [37, 5]]
    },
    {
      "id": 33,
      "type": 2,
      "layer_id": 1,
      "name": "hatch-stripe-b",
      "color": 8421504,
      "color_source": "BYLAYER",
      "source_type": "HATCH",
      "edit_mode": "proxy",
      "proxy_kind": "hatch",
      "group_id": 701,
      "hatch_id": 17,
      "hatch_pattern": "ANSI31",
      "space": 1,
      "layout": "Layout-A",
      "line": [[31, 5], [37, 1]]
    },
    {
      "id": 34,
      "type": 2,
      "layer_id": 1,
      "name": "hatch-layout-b",
      "color": 8421504,
      "color_source": "BYLAYER",
      "source_type": "HATCH",
      "edit_mode": "proxy",
      "proxy_kind": "hatch",
      "group_id": 701,
      "hatch_id": 17,
      "hatch_pattern": "ANSI31",
      "space": 1,
      "layout": "Layout-B",
      "line": [[30, 10], [38, 10]]
    },
    {
      "id": 41,
      "type": 2,
      "layer_id": 1,
      "name": "leader-stem",
      "color": 8421504,
      "color_source": "BYLAYER",
      "source_type": "LEADER",
      "edit_mode": "proxy",
      "proxy_kind": "leader",
      "group_id": 702,
      "space": 1,
      "layout": "Layout-A",
      "line": [[50, 0], [56, 6]]
    },
    {
      "id": 42,
      "type": 7,
      "layer_id": 1,
      "name": "leader-text",
      "color": 8421504,
      "color_source": "BYLAYER",
      "source_type": "LEADER",
      "edit_mode": "proxy",
      "proxy_kind": "leader",
      "group_id": 702,
      "space": 1,
      "layout": "Layout-A",
      "text": {
        "pos": [58, 7],
        "h": 2.5,
        "rot": 0,
        "value": "LEADER_NOTE"
      }
    },
    {
      "id": 43,
      "type": 2,
      "layer_id": 1,
      "name": "leader-layout-b",
      "color": 8421504,
      "color_source": "BYLAYER",
      "source_type": "LEADER",
      "edit_mode": "proxy",
      "proxy_kind": "leader",
      "group_id": 702,
      "space": 1,
      "layout": "Layout-B",
      "line": [[52, 10], [58, 16]]
    }
  ]
}
