{
  "cadgf_version": "1.0.0",
  "schema_version": 1,
  "feature_flags": {"earcut": false, "clipper2": false},
  "metadata": {
    "label": "",
    "author": "",
    "company": "",
    "comment": "",
    "created_at": "",
    "modified_at": "",
    "unit_name": "",
    "meta": {"dxf.default_space": "0", "dxf.default_text_height": "2.500000", "dxf.entity.1.color_source": "BYLAYER", "dxf.entity.1.edit_mode": "proxy", "dxf.entity.1.leader_landing_x": "12.000000", "dxf.entity.1.leader_landing_y": "18.000000", "dxf.entity.1.proxy_kind": "mleader", "dxf.entity.1.source_anchor_x": "12.000000", "dxf.entity.1.source_anchor_y": "18.000000", "dxf.entity.1.source_type": "LEADER", "dxf.entity.1.space": "0", "dxf.entity.1.text_attachment": "5", "dxf.entity.1.text_kind": "mleader", "dxf.entity.1.text_width": "40.000000", "dxf.hatch_pattern_boundary_points_clamped_hatches": "0", "dxf.hatch_pattern_boundary_points_limit": "20000", "dxf.hatch_pattern_boundary_points_max": "0", "dxf.hatch_pattern_clamped": "0", "dxf.hatch_pattern_clamped_hatches": "0", "dxf.hatch_pattern_edge_budget_exhausted_hatches": "0", "dxf.hatch_pattern_edge_checks": "0", "dxf.hatch_pattern_edge_checks_limit_per_doc": "40000000", "dxf.hatch_pattern_edge_checks_limit_per_hatch": "10000000", "dxf.hatch_pattern_emitted_lines": "0", "dxf.hatch_pattern_ksteps_limit": "5000", "dxf.hatch_pattern_stride_max": "1", "dxf.text.align_complete": "0", "dxf.text.align_partial": "0", "dxf.text.align_partial_x_only": "0", "dxf.text.align_partial_y_only": "0", "dxf.text.align_policy": "strict", "dxf.text.align_used": "0", "dxf.text.entities_emitted": "1", "dxf.text.entities_seen": "1", "dxf.text.nonfinite_values": "0", "dxf.text.skipped_missing_xy": "0"}
  },
  "settings": {"unit_scale": 1.000000},
  "layers": [
    {"id": 0, "name": "0", "color": 16777215, "visible": 1, "locked": 0, "printable": 1, "frozen": 0, "construction": 0},
    {"id": 1, "name": "AnnoLayer", "color": 16777215, "visible": 1, "locked": 0, "printable": 1, "frozen": 0, "construction": 0}
  ],
  "entities": [
    {"id": 1, "type": 7, "layer_id": 1, "name": "", "line_type_scale": 1.000000, "group_id": 1, "color_source": "BYLAYER", "space": 0, "source_type": "LEADER", "edit_mode": "proxy", "proxy_kind": "mleader", "text": {"pos": [12.000000, 18.000000], "h": 2.500000, "rot": 0.000000, "value": "MLEADER_STEP186\nSECOND_LINE"}, "text_kind": "mleader", "text_width": 40.000000, "text_attachment": 5, "source_anchor": [12.000000, 18.000000], "leader_landing": [12.000000, 18.000000]}
  ]
}
